{
  "schema_version": 1,
  "id": "claude-code",
  "type": "telegram-chat",
  "name": "Claude Code",
  "url": "https://t.me/claudecode",
  "audience_size": 0,
  "topics": ["claude-code", "anthropic", "ai-coding", "agents"],
  "post_rules": "Share Claude Code tips, skills, MCP servers, and workflows. Self-promo fine if it's a Claude Code plugin or skill. Keep off-topic AI chat minimal.",
  "post_format": "casual",
  "language": "en",
  "last_verified_at": "2026-04-24",
  "contributor": "beautyfree",
  "description": "Community around Anthropic's Claude Code CLI. URL and audience_size both unverified — confirm before relying on this entry."
}
