{
  "schema_version": 1,
  "id": "microsaas",
  "type": "subreddit",
  "name": "r/microsaas",
  "url": "https://www.reddit.com/r/microsaas/",
  "audience_size": 110000,
  "topics": ["micro-saas", "bootstrapping", "solo-founders"],
  "post_rules": "Higher signal than r/SaaS. Revenue stories and teardowns get traction; launches without numbers flop. Share MRR, stack, what's working, what isn't.",
  "post_format": "manifest",
  "language": "en",
  "last_verified_at": "2026-04-24",
  "contributor": "beautyfree",
  "description": "Community for small, profitable SaaS. Numbers-in-title posts outperform everything else."
}
