{
  "schema_version": 1,
  "id": "saas",
  "type": "subreddit",
  "name": "r/SaaS",
  "url": "https://www.reddit.com/r/SaaS/",
  "audience_size": 400000,
  "topics": ["saas", "startups", "indie-hackers"],
  "post_rules": "Self-promo tolerated when wrapped in a lesson or milestone — 'what I learned going 0 to 100 users' beats 'check out my app'. Flair correctly or mods remove. No bare links.",
  "post_format": "manifest",
  "language": "en",
  "last_verified_at": "2026-04-24",
  "contributor": "beautyfree",
  "description": "Large SaaS-focused subreddit. Noisier than r/microsaas — needs a hook, a number, or a retro to break through."
}
