{
  "schema_version": 1,
  "id": "startups-ru",
  "type": "telegram-chat",
  "name": "Стартапы и ко",
  "url": "https://t.me/startups",
  "audience_size": 0,
  "topics": ["startups", "russian", "founders"],
  "post_rules": "Russian-speaking startup community. Share what you're building with context — stack, problem, traction. Pure marketing copy in English gets ignored.",
  "post_format": "casual",
  "language": "ru",
  "last_verified_at": "2026-04-24",
  "contributor": "beautyfree",
  "description": "Russian-language Telegram chat for startup founders (t.me/startups). audience_size unverified."
}
